{
  "dia": [
    {
      "url": "http://ms.gov.br/",
      "visitas": 1269
    },
    {
      "url": "https://www.ms.gov.br/orgao/detrandepartamento-estadual-de-transito-de-mato-grosso-do-sul151/8",
      "visitas": 321
    },
    {
      "url": "https://www.ms.gov.br/transito-e-transportes/emitir-guia-de-licenciamento-anual100/",
      "visitas": 303
    },
    {
      "url": "https://www.ms.gov.br/direitos-e-cidadania/expedicao-de-carteira-de-identidade127",
      "visitas": 277
    },
    {
      "url": "https://www.ms.gov.br/orgao/jucemsjunta-comercial-do-estado-de-mato-grosso-do-sul118/servicos",
      "visitas": 171
    },
    {
      "url": "https://www.ms.gov.br/empresa-industria-e-comercio/pesquisar-viabilidade198/",
      "visitas": 143
    },
    {
      "url": "https://www.ms.gov.br/orgao/sefaz-mssecretaria-de-estado-de-fazenda-de-mato-grosso-do-sul87/servicos",
      "visitas": 122
    },
    {
      "url": "https://www.ms.gov.br/financas-e-impostos/portal-e-fazenda-cadastro135/",
      "visitas": 121
    },
    {
      "url": "https://www.ms.gov.br/workspace",
      "visitas": 121
    },
    {
      "url": "https://www.ms.gov.br/empresa-industria-e-comercio/emitir-certidao-simplificada-digital84/",
      "visitas": 104
    },
    {
      "url": "https://www.ms.gov.br/financas-e-impostos/certidao-tributaria-estadual-emissao152/",
      "visitas": 94
    },
    {
      "url": "https://www.ms.gov.br/financas-e-impostos/ipva-consulta-de-debito54/",
      "visitas": 89
    },
    {
      "url": "https://www.ms.gov.br/seguranca/delegacia-virtual-devir105/",
      "visitas": 75
    },
    {
      "url": "https://www.ms.gov.br/financas-e-impostos/ipva-troca-de-veiculo-reducao-p-pessoa-com-deficiencia-pcd39",
      "visitas": 74
    },
    {
      "url": "https://www.ms.gov.br/workspace/minha-area/meus-sistemas",
      "visitas": 72
    },
    {
      "url": "https://www.ms.gov.br/empresa-industria-e-comercio/certidao-de-inteiro-teor-digital19/",
      "visitas": 57
    },
    {
      "url": "https://www.ms.gov.br/financas-e-impostos/pagamento-de-ipva-inscrito-em-divida-ativa134",
      "visitas": 54
    },
    {
      "url": "https://www.ms.gov.br/financas-e-impostos/documento-de-arrecadacao-do-estado-de-mato-grosso-do-sul-daems-emissao5/",
      "visitas": 52
    },
    {
      "url": "https://www.ms.gov.br/orgao/imasulinstituto-de-meio-ambiente-de-mato-grosso-do-sul143/servicos",
      "visitas": 49
    },
    {
      "url": "https://www.ms.gov.br/financas-e-impostos/emitir-boleto-para-pagamento-de-ipva-ou-licenciamento-de-veiculos-em-divida-ativa158",
      "visitas": 45
    }
  ],
  "semana": [
    {
      "url": "http://ms.gov.br/",
      "visitas": 6298
    },
    {
      "url": "https://www.ms.gov.br/transito-e-transportes/emitir-guia-de-licenciamento-anual100/",
      "visitas": 1936
    },
    {
      "url": "https://www.ms.gov.br/orgao/detrandepartamento-estadual-de-transito-de-mato-grosso-do-sul151/8",
      "visitas": 1918
    },
    {
      "url": "https://www.ms.gov.br/direitos-e-cidadania/expedicao-de-carteira-de-identidade127",
      "visitas": 1647
    },
    {
      "url": "https://www.ms.gov.br/orgao/jucemsjunta-comercial-do-estado-de-mato-grosso-do-sul118/servicos",
      "visitas": 800
    },
    {
      "url": "https://www.ms.gov.br/empresa-industria-e-comercio/pesquisar-viabilidade198/",
      "visitas": 627
    },
    {
      "url": "https://www.ms.gov.br/orgao/sefaz-mssecretaria-de-estado-de-fazenda-de-mato-grosso-do-sul87/servicos",
      "visitas": 606
    },
    {
      "url": "https://www.ms.gov.br/seguranca/delegacia-virtual-devir105/",
      "visitas": 604
    },
    {
      "url": "https://www.ms.gov.br/financas-e-impostos/ipva-consulta-de-debito54/",
      "visitas": 586
    },
    {
      "url": "https://www.ms.gov.br/financas-e-impostos/portal-e-fazenda-cadastro135/",
      "visitas": 579
    },
    {
      "url": "https://www.ms.gov.br/workspace",
      "visitas": 493
    },
    {
      "url": "https://www.ms.gov.br/financas-e-impostos/ipva-troca-de-veiculo-reducao-p-pessoa-com-deficiencia-pcd39",
      "visitas": 467
    },
    {
      "url": "https://www.ms.gov.br/empresa-industria-e-comercio/emitir-certidao-simplificada-digital84/",
      "visitas": 416
    },
    {
      "url": "https://www.ms.gov.br/financas-e-impostos/pagamento-de-ipva-inscrito-em-divida-ativa134",
      "visitas": 404
    },
    {
      "url": "https://www.ms.gov.br/financas-e-impostos/certidao-tributaria-estadual-emissao152/",
      "visitas": 316
    },
    {
      "url": "https://www.ms.gov.br/financas-e-impostos/emitir-boleto-para-pagamento-de-ipva-ou-licenciamento-de-veiculos-em-divida-ativa158",
      "visitas": 281
    },
    {
      "url": "https://www.ms.gov.br/trabalho-emprego-e-previdencia/anunciar-vagas-de-emprego-no-sine-sistema-nacional-de-emprego71/",
      "visitas": 280
    },
    {
      "url": "/financas-e-impostos/ - Others",
      "visitas": 273
    },
    {
      "url": "https://www.ms.gov.br/empresa-industria-e-comercio/certidao-de-inteiro-teor-digital19/",
      "visitas": 254
    },
    {
      "url": "https://www.ms.gov.br/workspace/minha-area/meus-sistemas",
      "visitas": 254
    }
  ],
  "mes": [
    {
      "url": "http://ms.gov.br/",
      "visitas": 22507
    },
    {
      "url": "https://www.ms.gov.br/transito-e-transportes/emitir-guia-de-licenciamento-anual100/",
      "visitas": 7487
    },
    {
      "url": "https://www.ms.gov.br/orgao/detrandepartamento-estadual-de-transito-de-mato-grosso-do-sul151/8",
      "visitas": 7176
    },
    {
      "url": "https://www.ms.gov.br/direitos-e-cidadania/expedicao-de-carteira-de-identidade127",
      "visitas": 6713
    },
    {
      "url": "https://www.ms.gov.br/orgao/jucemsjunta-comercial-do-estado-de-mato-grosso-do-sul118/servicos",
      "visitas": 3020
    },
    {
      "url": "https://www.ms.gov.br/financas-e-impostos/ipva-consulta-de-debito54/",
      "visitas": 2382
    },
    {
      "url": "https://www.ms.gov.br/orgao/sefaz-mssecretaria-de-estado-de-fazenda-de-mato-grosso-do-sul87/servicos",
      "visitas": 2365
    },
    {
      "url": "https://www.ms.gov.br/empresa-industria-e-comercio/pesquisar-viabilidade198/",
      "visitas": 2364
    },
    {
      "url": "https://www.ms.gov.br/financas-e-impostos/portal-e-fazenda-cadastro135/",
      "visitas": 2290
    },
    {
      "url": "https://www.ms.gov.br/seguranca/delegacia-virtual-devir105/",
      "visitas": 1826
    },
    {
      "url": "https://www.ms.gov.br/workspace",
      "visitas": 1798
    },
    {
      "url": "https://www.ms.gov.br/empresa-industria-e-comercio/emitir-certidao-simplificada-digital84/",
      "visitas": 1566
    },
    {
      "url": "https://www.ms.gov.br/financas-e-impostos/ipva-troca-de-veiculo-reducao-p-pessoa-com-deficiencia-pcd39",
      "visitas": 1563
    },
    {
      "url": "https://www.ms.gov.br/financas-e-impostos/certidao-tributaria-estadual-emissao152/",
      "visitas": 1391
    },
    {
      "url": "https://www.ms.gov.br/financas-e-impostos/pagamento-de-ipva-inscrito-em-divida-ativa134",
      "visitas": 1343
    },
    {
      "url": "/financas-e-impostos/ - Others",
      "visitas": 1262
    },
    {
      "url": "https://www.ms.gov.br/comunicacao-e-transparencia/falar-com-a-gloria167/",
      "visitas": 1068
    },
    {
      "url": "https://www.ms.gov.br/workspace/minha-area/meus-sistemas",
      "visitas": 967
    },
    {
      "url": "https://www.ms.gov.br/financas-e-impostos/emitir-boleto-para-pagamento-de-ipva-ou-licenciamento-de-veiculos-em-divida-ativa158",
      "visitas": 956
    },
    {
      "url": "https://www.ms.gov.br/empresa-industria-e-comercio/certidao-de-inteiro-teor-digital19/",
      "visitas": 937
    }
  ],
  "ano": [
    {
      "url": "http://ms.gov.br/",
      "visitas": 1099545
    },
    {
      "url": "https://www.ms.gov.br/orgao/detrandepartamento-estadual-de-transito-de-mato-grosso-do-sul151/8",
      "visitas": 271355
    },
    {
      "url": "https://www.ms.gov.br/transito-e-transportes/emitir-guia-de-licenciamento-anual100/",
      "visitas": 164227
    },
    {
      "url": "https://www.ms.gov.br/workspace/minha-area/meus-sistemas",
      "visitas": 132251
    },
    {
      "url": "https://www.ms.gov.br/direitos-e-cidadania/expedicao-de-carteira-de-identidade127",
      "visitas": 116348
    },
    {
      "url": "/noticias/ - Others",
      "visitas": 111059
    },
    {
      "url": "https://www.ms.gov.br/orgao/sefaz-mssecretaria-de-estado-de-fazenda-de-mato-grosso-do-sul87/servicos",
      "visitas": 97927
    },
    {
      "url": "https://www.ms.gov.br/financas-e-impostos/portal-e-fazenda-cadastro135/",
      "visitas": 69720
    },
    {
      "url": "https://www.ms.gov.br/financas-e-impostos/ipva-consulta-de-debito54/",
      "visitas": 67302
    },
    {
      "url": "https://www.ms.gov.br/workspace",
      "visitas": 65110
    },
    {
      "url": "https://www.ms.gov.br/orgao/sed-mssecretaria-de-estado-de-educacao-de-mato-grosso-do-sul83/servicos",
      "visitas": 54539
    },
    {
      "url": "/financas-e-impostos/ - Others",
      "visitas": 50252
    },
    {
      "url": "https://www.ms.gov.br/financas-e-impostos/certidao-tributaria-estadual-emissao152/",
      "visitas": 44921
    },
    {
      "url": "https://www.ms.gov.br/seguranca/expedicao-de-certidao-de-antecedentes-criminais35/",
      "visitas": 38738
    },
    {
      "url": "https://www.ms.gov.br/orgao/jucemsjunta-comercial-do-estado-de-mato-grosso-do-sul118/servicos",
      "visitas": 38024
    },
    {
      "url": "https://www.ms.gov.br/habitacao/inscricaocadastro67/",
      "visitas": 35214
    },
    {
      "url": "https://www.ms.gov.br/buscar/q=ipva",
      "visitas": 32820
    },
    {
      "url": "https://www.ms.gov.br/transito-e-transportes/emissao-de-crlv-e-licenciamento-digital13",
      "visitas": 31072
    },
    {